{
  "schemaVersion": "1.0",
  "id": "the-door-in-the-wall",
  "title": "La puerta en el muro",
  "titleRu": "Дверь в стене",
  "originalTitle": "The Door in the Wall",
  "author": {
    "id": "h-g-wells",
    "name": "H. G. Wells"
  },
  "genres": [
    "Фантастика",
    "Уэллс"
  ],
  "synopsisRu": "Успешный политик Лайонел Уоллес признаётся другу, что в детстве нашёл зелёную дверь в белой стене, за которой скрывался волшебный сад. На протяжении всей жизни он снова и снова видел эту дверь, но каждый раз выбирал карьеру и долг — пока однажды ночью не исчез навсегда.",
  "levels": {
    "a1": {
      "available": false,
      "chapterCount": 0
    },
    "a2": {
      "available": true,
      "chapterCount": 1
    },
    "b1": {
      "available": true,
      "chapterCount": 1
    },
    "b2": {
      "available": true,
      "chapterCount": 1
    },
    "c1": {
      "available": true,
      "chapterCount": 1
    },
    "c2": {
      "available": false,
      "chapterCount": 0
    }
  }
}
