{
  "schemaVersion": "1.0",
  "id": "the-campaign-grafter",
  "title": "El timador de la campaña",
  "titleRu": "Мошенник предвыборной кампании",
  "originalTitle": "The Campaign Grafter",
  "author": {
    "id": "arthur-b-reeve",
    "name": "Arthur B. Reeve"
  },
  "genres": [
    "Детектив",
    "Крейг Кеннеди"
  ],
  "synopsisRu": "Детектив Крейг Кеннеди расследует фотографический шантаж накануне выборов: кандидату-реформатору Трэвису угрожают поддельными снимками, якобы доказывающими его связь с политическими боссами. С помощью метрической фотографии, скрытого диктографа и крошечной камеры-обскуры Кеннеди разоблачает настоящего предателя — ближайшего соратника Трэвиса.",
  "levels": {
    "a1": {
      "available": false,
      "chapterCount": 0
    },
    "a2": {
      "available": true,
      "chapterCount": 1
    },
    "b1": {
      "available": true,
      "chapterCount": 1
    },
    "b2": {
      "available": true,
      "chapterCount": 1
    },
    "c1": {
      "available": true,
      "chapterCount": 1
    },
    "c2": {
      "available": false,
      "chapterCount": 0
    }
  }
}
