{
  "schemaVersion": "1.0",
  "id": "the-germ-of-death",
  "title": "El germen de la muerte",
  "titleRu": "Зародыш смерти",
  "originalTitle": "The Germ of Death",
  "author": {
    "id": "arthur-b-reeve",
    "name": "Arthur B. Reeve"
  },
  "genres": [
    "Детектив",
    "Крейг Кеннеди"
  ],
  "synopsisRu": "Профессор Крейг Кеннеди расследует таинственную болезнь, поразившую лидеров русских революционеров в Нью-Йорке, и обнаруживает, что за эпидемией азиатской лихорадки и серией взрывов стоит изощрённый агент царской охранки.",
  "levels": {
    "a1": {
      "available": false,
      "chapterCount": 0
    },
    "a2": {
      "available": true,
      "chapterCount": 1
    },
    "b1": {
      "available": true,
      "chapterCount": 1
    },
    "b2": {
      "available": true,
      "chapterCount": 1
    },
    "c1": {
      "available": true,
      "chapterCount": 1
    },
    "c2": {
      "available": false,
      "chapterCount": 0
    }
  }
}
