{
  "schemaVersion": "1.0",
  "id": "the-seismograph-adventure",
  "title": "La aventura del sismógrafo",
  "titleRu": "Приключение сейсмографа",
  "originalTitle": "The Seismograph Adventure",
  "author": {
    "id": "arthur-b-reeve",
    "name": "Arthur B. Reeve"
  },
  "genres": [
    "Детектив",
    "Крейг Кеннеди"
  ],
  "synopsisRu": "Профессор Крейг Кеннеди расследует загадочную смерть богатой миссис Вандам, отравленной искусно замаскированной капсулой, и разоблачает медиума-мошенника с помощью сверхчувствительного сейсмографа. Прибор записывает шаги «призрака», оказавшегося живым преступником, а анализ чернил и химический состав яда окончательно изобличают убийцу.",
  "levels": {
    "a1": {
      "available": false,
      "chapterCount": 0
    },
    "a2": {
      "available": true,
      "chapterCount": 1
    },
    "b1": {
      "available": true,
      "chapterCount": 1
    },
    "b2": {
      "available": true,
      "chapterCount": 1
    },
    "c1": {
      "available": true,
      "chapterCount": 1
    },
    "c2": {
      "available": false,
      "chapterCount": 0
    }
  }
}
