{
  "schemaVersion": "1.0",
  "id": "the-dead",
  "title": "Los muertos",
  "titleRu": "Мёртвые",
  "originalTitle": "The Dead",
  "author": {
    "id": "james-joyce",
    "name": "James Joyce"
  },
  "genres": [
    "Классика",
    "Модернизм",
    "Психология"
  ],
  "synopsisRu": "",
  "levels": {
    "a1": {
      "available": false,
      "chapterCount": 0
    },
    "a2": {
      "available": false,
      "chapterCount": 0
    },
    "b1": {
      "available": true,
      "chapterCount": 1
    },
    "b2": {
      "available": false,
      "chapterCount": 0
    },
    "c1": {
      "available": false,
      "chapterCount": 0
    },
    "c2": {
      "available": false,
      "chapterCount": 0
    }
  }
}
