{
  "schemaVersion": "1.0",
  "id": "the-mystic-poisoner",
  "title": "El envenenador místico",
  "titleRu": "Мистический отравитель",
  "originalTitle": "The Mystic Poisoner",
  "author": {
    "id": "arthur-b-reeve",
    "name": "Arthur B. Reeve"
  },
  "genres": [
    "Детектив",
    "Крейг Кеннеди"
  ],
  "synopsisRu": "Крейг Кеннеди расследует загадочную гибель британского капитана Ширли в нью-йоркском отеле: никаких следов оружия или яда, дверь заперта изнутри. Разгадка оказывается в стеклянной бомбе, наполненной индийским токсином абрин, — часть заговора с целью финансирования революции в Индии.",
  "levels": {
    "a1": {
      "available": false,
      "chapterCount": 0
    },
    "a2": {
      "available": true,
      "chapterCount": 1
    },
    "b1": {
      "available": true,
      "chapterCount": 1
    },
    "b2": {
      "available": true,
      "chapterCount": 1
    },
    "c1": {
      "available": true,
      "chapterCount": 1
    },
    "c2": {
      "available": false,
      "chapterCount": 0
    }
  }
}
