{
  "schemaVersion": "1.0",
  "id": "the-paradise-of-thieves",
  "title": "El paraíso de los ladrones",
  "titleRu": "Рай воров",
  "originalTitle": "The Paradise of Thieves",
  "author": {
    "id": "g-k-chesterton",
    "name": "G. K. Chesterton"
  },
  "genres": [
    "Детектив",
    "Отец Браун"
  ],
  "synopsisRu": "Поэт Мускари и семья английского банкира Харрогейта попадают в засаду в горах Апеннин, устроенную загадочным Королём воров. Отец Браун замечает три логических противоречия, которые раскрывают куда более тёмную тайну, чем простой разбой.",
  "levels": {
    "a1": {
      "available": false,
      "chapterCount": 0
    },
    "a2": {
      "available": true,
      "chapterCount": 1
    },
    "b1": {
      "available": true,
      "chapterCount": 1
    },
    "b2": {
      "available": true,
      "chapterCount": 1
    },
    "c1": {
      "available": true,
      "chapterCount": 1
    },
    "c2": {
      "available": false,
      "chapterCount": 0
    }
  }
}
