{
  "schemaVersion": "1.0",
  "id": "frankenstein",
  "title": "Frankenstein",
  "titleRu": "Франкенштейн",
  "originalTitle": "Frankenstein; or, The Modern Prometheus",
  "author": {
    "id": "mary-shelley",
    "name": "Mary Shelley"
  },
  "genres": [
    "Фантастика",
    "Готика",
    "Ужасы"
  ],
  "synopsisRu": "Молодой учёный Виктор Франкенштейн постигает тайну жизни и создаёт из неживой материи существо. Готический роман Мэри Шелли.",
  "levels": {
    "a1": {
      "available": false,
      "chapterCount": 0
    },
    "a2": {
      "available": true,
      "chapterCount": 6
    },
    "b1": {
      "available": true,
      "chapterCount": 6
    },
    "b2": {
      "available": true,
      "chapterCount": 6
    },
    "c1": {
      "available": true,
      "chapterCount": 6
    },
    "c2": {
      "available": false,
      "chapterCount": 0
    }
  }
}
