{
  "schemaVersion": "1.0",
  "id": "the-food-of-the-gods",
  "title": "El alimento de los dioses",
  "titleRu": "Пища богов",
  "originalTitle": "The Food of the Gods",
  "author": {
    "id": "h-g-wells",
    "name": "H. G. Wells"
  },
  "genres": [
    "Фантастика",
    "Сатира",
    "Гиганты"
  ],
  "synopsisRu": "Учёные изобретают вещество, заставляющее всё живое расти до гигантских размеров. Фантастический роман Герберта Уэллса.",
  "levels": {
    "a1": {
      "available": false,
      "chapterCount": 0
    },
    "a2": {
      "available": true,
      "chapterCount": 6
    },
    "b1": {
      "available": true,
      "chapterCount": 6
    },
    "b2": {
      "available": true,
      "chapterCount": 6
    },
    "c1": {
      "available": true,
      "chapterCount": 6
    },
    "c2": {
      "available": false,
      "chapterCount": 0
    }
  }
}
