{
  "schemaVersion": "1.0",
  "id": "wuthering-heights",
  "title": "Cumbres borrascosas",
  "titleRu": "Грозовой перевал",
  "originalTitle": "Wuthering Heights",
  "author": {
    "id": "emily-bronte",
    "name": "Emily Brontë"
  },
  "genres": [
    "Готика",
    "Драма",
    "Любовь"
  ],
  "synopsisRu": "История роковой страсти Хитклифа и Кэтрин на суровых йоркширских вересковых пустошах. Роман Эмили Бронте.",
  "levels": {
    "a1": {
      "available": false,
      "chapterCount": 0
    },
    "a2": {
      "available": true,
      "chapterCount": 7
    },
    "b1": {
      "available": true,
      "chapterCount": 7
    },
    "b2": {
      "available": true,
      "chapterCount": 7
    },
    "c1": {
      "available": true,
      "chapterCount": 7
    },
    "c2": {
      "available": false,
      "chapterCount": 0
    }
  }
}
