{
  "schemaVersion": "1.0",
  "id": "ethan-frome",
  "title": "Ethan Frome",
  "titleRu": "Итан Фром",
  "originalTitle": "Ethan Frome",
  "author": {
    "id": "edith-wharton",
    "name": "Edith Wharton"
  },
  "genres": [
    "Повесть",
    "Драма",
    "Новая Англия"
  ],
  "synopsisRu": "Бедный фермер в суровой Новой Англии разрывается между больной женой и её юной кузиной. Повесть Эдит Уортон.",
  "levels": {
    "a1": {
      "available": false,
      "chapterCount": 0
    },
    "a2": {
      "available": true,
      "chapterCount": 4
    },
    "b1": {
      "available": true,
      "chapterCount": 4
    },
    "b2": {
      "available": true,
      "chapterCount": 4
    },
    "c1": {
      "available": true,
      "chapterCount": 4
    },
    "c2": {
      "available": false,
      "chapterCount": 0
    }
  }
}
